{"assumptions":["common_reference","zero_base_fee"],"baseline":{"kind":"analysis_time","price":"77631.4","source":{"coin":"BTC","snapshot":"ed779f0670253d58214b98a18efe79bf08e65312b5364ebd9b49a5fd708ee1d1"}},"capture":{"max_skew_ms":"5000","measured_by":"research/2026-09-18/capture.py, recomputed from the retained request records","skew_ms":"-687"},"domain":{"lower":"60000","upper":"110000"},"exposure":{"kind":"linear_spot","quantity":"0.1","reference":"hl:perp:BTC:mark-interp","underlying":"BTC"},"legs":[{"acquisition":{"kind":"book_walk","path":"direct_book","snapshot":"00118f3902a1a8c491d1dd22782527524e71eea68f610918fa5495d5105b1218"},"family":"recurring.priceBucket","id":"bucket0-yes","instance":{"catalogue":"a1692390028fdbfa2f81df15768431347fab42faa8add5e96b24a8813e9f99ac","coin":"#39710","outcome":"3971"},"semantics_version":"0f75191302086ba1cf59587956d1593a73372a729a98cd94556d56cda3a2b539","side":"yes","size":"924","terms":{"expiry":"2026-09-19T06:00:00Z","index":"0","period":"1d","thresholds":["75908","79007"],"underlying":"BTC"}}],"objective":[{"id":"loss_cap","min_pnl":"-1000"}],"objective_reference":"hl:perp:BTC:mark-interp","objective_valuation_time":"2026-09-19T06:00:00Z","other_costs":"0","schema_version":"1","units":{"exposure":"BTC","money":"USDC","price":"USDC per BTC","size":"contracts"}}
